{
  "schema_version": 1,
  "message_id": "01950000-0000-7000-8000-000000002002",
  "correlation_id": "run:01950000-0000-7000-8000-000000000101",
  "sent_at": "2026-03-09T12:00:00Z",
  "type": "status",
  "run_id": "01950000-0000-7000-8000-000000000101",
  "profile": "acme-site",
  "profile_version": "1.4.0",
  "state": "started",
  "detail": null
}
